IMDb Rank,IMDb ID,Movie Title,Year Released,IMDb Rating,Rated,Genre,Director,Actors,Production,Language,Awards,Plot
215,tt1979320,Rush,2013,8.1,R,"Biography, Drama, Sport",Ron Howard,"Chris Hemsworth, Daniel Brühl, Olivia Wilde, Alexandra Maria Lara",Universal Pictures,"English, German, Italian, French, Spanish",Nominated for 2 Golden Globes. Another 6 wins & 63 nominations.,The merciless 1970s rivalry between Formula One rivals James Hunt and Niki Lauda.
216,tt0019254,The Passion of Joan of Arc,1928,8.1,Not Rated,"Biography, Drama, History",Carl Theodor Dreyer,"Maria Falconetti, Eugene Silvain, André Berley, Maurice Schutz",N/A,French,3 wins & 2 nominations.,"In 1431, Jeanne d'Arc is placed on trial on charges of heresy. The ecclesiastical jurists attempt to force Jeanne to recant her claims of holy visions."
217,tt3315342,Logan,2017,8.0,R,"Action, Drama, Sci-Fi, Thriller",James Mangold,"Hugh Jackman, Patrick Stewart, Dafne Keen, Boyd Holbrook",N/A,"English, Spanish",Nominated for 1 Oscar. Another 26 wins & 73 nominations.,"In a future where mutants are nearly extinct, an elderly and weary Logan leads a quiet life. But when Laura, a mutant child pursued by scientists, comes to him for help, he must get her to safety."
218,tt0097165,Dead Poets Society,1989,8.0,PG,"Comedy, Drama",Peter Weir,"Robin Williams, Robert Sean Leonard, Ethan Hawke, Josh Charles",Buena Vista Pictures,"English, Latin",Won 1 Oscar. Another 19 wins & 18 nominations.,English teacher John Keating inspires his students to look at poetry with a different perspective of authentic knowledge and feelings. -Camilo Alarcón
219,tt1201607,Harry Potter and the Deathly Hallows: Part 2,2011,8.0,PG-13,"Adventure, Drama, Fantasy, Mystery",David Yates,"Ralph Fiennes, Michael Gambon, Alan Rickman, Daniel Radcliffe",Warner Bros. Pictures,English,Nominated for 3 Oscars. Another 45 wins & 91 nominations.,"Harry, Ron, and Hermione search for Voldemort's remaining Horcruxes in their effort to destroy the Dark Lord as the final battle rages on at Hogwarts."
220,tt0060107,Andrei Rublev,1966,8.0,R,"Biography, Drama, History",Andrei Tarkovsky,"Anatoliy Solonitsyn, Ivan Lapikov, Nikolay Grinko, Nikolay Sergeev",Criterion Collection,"Russian, Italian, Tatar",3 wins & 1 nomination.,"The life, times and afflictions of the fifteenth-century Russian iconographer St. Andrei Rublev."
221,tt0053198,The 400 Blows,1959,8.0,Not Rated,"Crime, Drama",François Truffaut,"Jean-Pierre Léaud, Claire Maurier, Albert Rémy, Guy Decomble",Zenith International Films,"French, English",Nominated for 1 Oscar. Another 9 wins & 6 nominations.,"A young boy, left without attention, delves into a life of petty crime."
222,tt0395169,Hotel Rwanda,2004,8.0,PG-13,"Biography, Drama, History, War",Terry George,"Xolani Mali, Don Cheadle, Desmond Dube, Hakeem Kae-Kazim",MGM,"English, French, Kinyarwanda",Nominated for 3 Oscars. Another 16 wins & 45 nominations.,Paul Rusesabagina was a hotel manager who housed over a thousand Tutsi refugees during their struggle against the Hutu militia in Rwanda.
223,tt0245712,Amores Perros,2000,8.0,R,"Drama, Thriller",Alejandro G. Iñárritu,"Emilio Echevarría, Gael García Bernal, Goya Toledo, Álvaro Guerrero",Lionsgate,Spanish,Nominated for 1 Oscar. Another 55 wins & 23 nominations.,"A horrific car accident connects three stories, each involving characters dealing with loss, regret, and life's harsh realities, all in the name of love."
224,tt0405508,Rang De Basanti,2006,8.0,Not Rated,"Comedy, Drama",Rakeysh Omprakash Mehra,"Aamir Khan, Siddharth, Sharman Joshi, Kunal Kapoor",N/A,"Hindi, Punjabi, English",Nominated for 1 BAFTA Film Award. Another 37 wins & 29 nominations.,"The story of six young Indians who assist an English woman to film a documentary on the freedom fighters from their past, and the events that lead them to relive the long-forgotten saga of freedom."
225,tt1895587,Spotlight,2015,8.0,R,"Biography, Crime, Drama",Tom McCarthy,"Mark Ruffalo, Michael Keaton, Rachel McAdams, Liev Schreiber",Open Road Films,English,Won 2 Oscars. Another 123 wins & 141 nominations.,"The true story of how the Boston Globe uncovered the massive scandal of child molestation and cover-up within the local Catholic Archdiocese, shaking the entire Catholic Church to its core."
226,tt4016934,The Handmaiden,2016,8.0,Not Rated,"Drama, Romance, Thriller",Chan-wook Park,"Min-hee Kim, Tae-ri Kim, Jung-woo Ha, Jin-woong Cho",N/A,"Korean, Japanese",Won 1 BAFTA Film Award. Another 64 wins & 104 nominations.,"A woman is hired as a handmaiden to a Japanese heiress, but secretly she is involved in a plot to defraud her."
227,tt0087544,Nausicaä of the Valley of the Wind,1984,8.0,PG,"Animation, Adventure, Fantasy, Sci-Fi",Hayao Miyazaki,"Sumi Shimamoto, Mahito Tsujimura, Hisako Kyôda, Gorô Naya",Starmaker Entertainment,Japanese,3 wins & 1 nomination.,Warrior and pacifist Princess Nausicaä desperately struggles to prevent two warring nations from destroying themselves and their dying planet.
228,tt8613070,Portrait of a Lady on Fire,2019,8.0,R,"Drama, Romance",Céline Sciamma,"Noémie Merlant, Adèle Haenel, Luàna Bajrami, Valeria Golino",N/A,"French, Italian",Nominated for 1 Golden Globe. Another 43 wins & 124 nominations.,"On an isolated island in Brittany at the end of the eighteenth century, a female painter is obliged to paint a wedding portrait of a young woman."
229,tt0075148,Rocky,1976,8.0,PG,"Drama, Sport",John G. Avildsen,"Sylvester Stallone, Talia Shire, Burt Young, Carl Weathers",United Artists,English,Won 3 Oscars. Another 17 wins & 21 nominations.,A small-time boxer gets a supremely rare chance to fight a heavy-weight champion in a bout in which he strives to go the distance for his self-respect.
230,tt0032976,Rebecca,1940,8.0,Approved,"Drama, Mystery, Romance, Thriller",Alfred Hitchcock,"Laurence Olivier, Joan Fontaine, George Sanders, Judith Anderson",United Artists,"English, French",Won 2 Oscars. Another 5 wins & 10 nominations.,A self-conscious woman juggles adjusting to her new role as an aristocrat's wife and avoiding being intimidated by his first wife's spectral presence.
232,tt0113247,La Haine,1995,8.0,Not Rated,"Crime, Drama",Mathieu Kassovitz,"Vincent Cassel, Hubert Koundé, Saïd Taghmaoui, Abdel Ahmed Ghili",Criterion Collection,French,8 wins & 14 nominations.,24 hours in the lives of three young men in the French suburbs the day after a violent riot.
233,tt0025316,It Happened One Night,1934,8.0,Approved,"Comedy, Romance",Frank Capra,"Clark Gable, Claudette Colbert, Walter Connolly, Roscoe Karns",Sony Pictures Home Entertainment,English,Won 5 Oscars. Another 5 wins & 2 nominations.,A spoiled heiress running away from her family is helped by a man who is actually a reporter in need of a story.
234,tt1954470,Gangs of Wasseypur,2012,8.0,Not Rated,"Action, Comedy, Crime, Drama, Thriller",Anurag Kashyap,"Manoj Bajpayee, Richa Chadha, Nawazuddin Siddiqui, Tigmanshu Dhulia",Studio 18,Hindi,17 wins & 45 nominations.,"A clash between Sultan and Shahid Khan leads to the expulsion of Khan from Wasseypur, and ignites a deadly blood feud spanning three generations."
235,tt0118694,In the Mood for Love,2000,8.0,PG,"Drama, Romance",Kar-Wai Wong,"Maggie Cheung, Tony Chiu-Wai Leung, Ping Lam Siu, Tung Cho 'Joe' Cheung",USA Films,"Cantonese, Shanghainese, French, Spanish",Nominated for 1 BAFTA Film Award. Another 45 wins & 50 nominations.,"Two neighbors, a woman and a man, form a strong bond after both suspect extramarital activities of their spouses. However, they agree to keep their bond platonic so as not to commit similar wrongs."
236,tt0381681,Before Sunset,2004,8.0,R,"Drama, Romance",Richard Linklater,"Ethan Hawke, Julie Delpy, Vernon Dobtcheff, Louise Lemoine Torrès",Warner Independent Pictures,"English, French",Nominated for 1 Oscar. Another 9 wins & 31 nominations.,"Nine years after Jesse and Celine first met, they encounter each other again on the French leg of Jesse's book tour."
237,tt0093779,The Princess Bride,1987,8.0,PG,"Adventure, Family, Fantasy, Romance",Rob Reiner,"Cary Elwes, Mandy Patinkin, Chris Sarandon, Christopher Guest",20th Century Fox,English,Nominated for 1 Oscar. Another 7 wins & 8 nominations.,"While home sick in bed, a young boy's grandfather reads him the story of a farmboy-turned-pirate who encounters numerous obstacles, enemies and allies in his quest to be reunited with his true love."
238,tt1454029,The Help,2011,8.0,PG-13,Drama,Tate Taylor,"Emma Stone, Viola Davis, Bryce Dallas Howard, Octavia Spencer",DreamWorks Studios,English,Won 1 Oscar. Another 79 wins & 120 nominations.,"An aspiring author during the civil rights movement of the 1960s decides to write a book detailing the African American maids' point of view on the white families for which they work, and the hardships they go through on a daily basis."
239,tt0087884,"Paris, Texas",1984,8.0,R,Drama,Wim Wenders,"Harry Dean Stanton, Nastassja Kinski, Dean Stockwell, Aurore Clément",20th Century Fox,"English, Spanish",Nominated for 1 Golden Globe. Another 16 wins & 10 nominations.,"Travis Henderson, an aimless drifter who has been missing for four years, wanders out of the desert and must reconnect with society, himself, his life, and his family."
240,tt4857264,The Invisible Guest,2016,8.0,N/A,"Crime, Mystery, Thriller",Oriol Paulo,"Mario Casas, Ana Wagener, Jose Coronado, Bárbara Lennie",N/A,Spanish,1 win & 2 nominations.,A successful entrepreneur accused of murder and a witness preparation expert have less than three hours to come up with an impregnable defence.
241,tt4430212,Drishyam,2015,8.0,Not Rated,"Crime, Drama, Mystery, Thriller",Nishikant Kamat,"Ajay Devgn, Shriya Saran, Tabu, Rajat Kapoor",N/A,Hindi,1 win & 2 nominations.,"Desperate measures are taken by a man who tries to save his family from the dark side of the law, after they commit an unexpected crime."
242,tt0088247,The Terminator,1984,8.0,R,"Action, Sci-Fi",James Cameron,"Arnold Schwarzenegger, Michael Biehn, Linda Hamilton, Paul Winfield",Orion Pictures Corporation,"English, Spanish",7 wins & 6 nominations.,"In 1984, a human soldier is tasked to stop an indestructible cyborg killing machine, both sent from 2029, from executing a young woman, whose unborn son is the key to humanity's future salvation."
243,tt0043338,Ace in the Hole,1951,8.0,Approved,"Drama, Film-Noir",Billy Wilder,"Kirk Douglas, Jan Sterling, Robert Arthur, Porter Hall",Paramount Pictures,"English, Spanish, Latin",Nominated for 1 Oscar. Another 4 wins & 2 nominations.,"A frustrated former big-city journalist now stuck working for an Albuquerque newspaper exploits a story about a man trapped in a cave to rekindle his career, but the situation quickly escalates into an out-of-control circus."
245,tt0169102,Lagaan: Once Upon a Time in India,2001,8.0,PG,"Adventure, Drama, Musical, Sport",Ashutosh Gowariker,"Aamir Khan, Gracy Singh, Rachel Shelley, Paul Blackthorne",B4U Entertainment,"Hindi, English, Awadhi, Urdu",Nominated for 1 Oscar. Another 54 wins & 19 nominations.,The people of a small village in Victorian India stake their future on a game of cricket against their ruthless British rulers.
246,tt0064115,Butch Cassidy and the Sundance Kid,1969,8.0,PG,"Biography, Crime, Drama, Western",George Roy Hill,"Paul Newman, Robert Redford, Katharine Ross, Strother Martin",20th Century Fox,"English, Spanish",Won 4 Oscars. Another 17 wins & 14 nominations.,"Wyoming, early 1900s. Butch Cassidy and The Sundance Kid are the leaders of a band of outlaws. After a train robbery goes wrong they find themselves on the run with a posse hard on their heels. Their solution - escape to Bolivia."
247,tt0103639,Aladdin,1992,8.0,G,"Animation, Adventure, Comedy, Family, Fantasy, Musical, Romance","Ron Clements, John Musker","Scott Weinger, Robin Williams, Linda Larkin, Jonathan Freeman",Walt Disney Pictures,English,Won 2 Oscars. Another 31 wins & 22 nominations.,A kindhearted street urchin and a power-hungry Grand Vizier vie for a magic lamp that has the power to make their deepest wishes come true.
248,tt0094625,Akira,1988,8.0,R,"Animation, Drama, Sci-Fi, Thriller",Katsuhiro Ôtomo,"Mitsuo Iwata, Nozomu Sasaki, Mami Koyama, Tesshô Genda",Streamline Pictures,Japanese,1 win.,A secret military project endangers Neo-Tokyo when it turns a biker gang member into a rampaging psychic psychopath who can only be stopped by two teenagers and a group of psychics.
249,tt0050613,Throne of Blood,1957,8.0,Not Rated,"Drama, History",Akira Kurosawa,"Toshirô Mifune, Isuzu Yamada, Takashi Shimura, Akira Kubo",Media Home Entertainment,Japanese,3 wins & 1 nomination.,"A war-hardened general, egged on by his ambitious wife, works to fulfill a prophecy that he would become lord of Spider's Web Castle."
250,tt0083922,Fanny and Alexander,1982,8.0,R,Drama,Ingmar Bergman,"Kristina Adolphson, Börje Ahlstedt, Pernilla Allwin, Kristian Almgren",Embassy Pictures Corporation,"Swedish, German, Yiddish, English, French",Won 4 Oscars. Another 21 wins & 11 nominations.,"Two young Swedish children experience the many comedies and tragedies of their family, the Ekdahls."
