IMDb Rank,IMDb ID,Movie Title,Year Released,IMDb Rating,Rated,Genre,Director,Actors,Production,Language,Awards,Plot
141,tt0457430,Pan's Labyrinth,2006,8.2,R,"Drama, Fantasy, War",Guillermo del Toro,"Ivana Baquero, Sergi López, Maribel Verdú, Doug Jones",Picturehouse,Spanish,Won 3 Oscars. Another 103 wins & 110 nominations.,"In the Falangist Spain of 1944, the bookish young stepdaughter of a sadistic army officer escapes into an eerie but captivating fantasy world."
142,tt1305806,The Secret in Their Eyes,2009,8.2,R,"Drama, Mystery, Romance, Thriller",Juan José Campanella,"Soledad Villamil, Ricardo Darín, Carla Quevedo, Pablo Rago",Sony Pictures Classics,Spanish,Won 1 Oscar. Another 52 wins & 42 nominations.,A retired legal counselor writes a novel hoping to find closure for one of his past unresolved homicide cases and for his unreciprocated love with his superior - both of which still haunt him decades later.
143,tt0096283,My Neighbor Totoro,1988,8.2,G,"Animation, Family, Fantasy",Hayao Miyazaki,"Noriko Hidaka, Chika Sakamoto, Shigesato Itoi, Sumi Shimamoto",Tokuma Shoten,Japanese,5 wins & 2 nominations.,"When two girls move to the country to be near their ailing mother, they have adventures with the wondrous forest spirits who live nearby."
144,tt0993846,The Wolf of Wall Street,2013,8.2,R,"Biography, Crime, Drama",Martin Scorsese,"Leonardo DiCaprio, Jonah Hill, Margot Robbie, Matthew McConaughey",Paramount Studios,"English, French",Nominated for 5 Oscars. Another 38 wins & 172 nominations.,"Based on the true story of Jordan Belfort, from his rise to a wealthy stock-broker living the high life to his fall involving crime, corruption and the federal government."
145,tt0081398,Raging Bull,1980,8.2,R,"Biography, Drama, Sport",Martin Scorsese,"Robert De Niro, Cathy Moriarty, Joe Pesci, Frank Vincent",United Artists,English,Won 2 Oscars. Another 22 wins & 28 nominations.,"The life of boxer Jake LaMotta, whose violence and temper that led him to the top in the ring destroyed his life outside of it."
146,tt0120735,"Lock, Stock and Two Smoking Barrels",1998,8.2,R,"Comedy, Crime",Guy Ritchie,"Jason Flemyng, Dexter Fletcher, Nick Moran, Jason Statham",Gramercy Pictures,English,Nominated for 1 BAFTA Film Award. Another 13 wins & 7 nominations.,"A botched card game in London triggers four friends, thugs, weed-growers, hard gangsters, loan sharks and debt collectors to collide with each other in a series of unexpected events, all for the sake of weed, cash and two antique shotguns."
147,tt0040897,The Treasure of the Sierra Madre,1948,8.1,Passed,"Adventure, Drama, Western",John Huston,"Humphrey Bogart, Walter Huston, Tim Holt, Bruce Bennett",WARNER BROTHERS PICTURES,"English, Spanish",Won 3 Oscars. Another 13 wins & 8 nominations.,Two Americans searching for work in Mexico convince an old prospector to help them mine for gold in the Sierra Madre Mountains.
148,tt0055031,Judgment at Nuremberg,1961,8.1,Not Rated,"Drama, War",Stanley Kramer,"Spencer Tracy, Burt Lancaster, Richard Widmark, Marlene Dietrich",United Artists,"English, German",Won 2 Oscars. Another 14 wins & 25 nominations.,"In 1948, an American court in occupied Germany tries four Nazis judged for war crimes."
149,tt0469494,There Will Be Blood,2007,8.1,R,Drama,Paul Thomas Anderson,"Daniel Day-Lewis, Martin Stringer, Matthew Braden Stringer, Jacob Stringer",Paramount Vantage,"English, American Sign Language",Won 2 Oscars. Another 110 wins & 137 nominations.,"A story of family, religion, hatred, oil and madness, focusing on a turn-of-the-century prospector in the early days of the business."
151,tt5027774,"Three Billboards Outside Ebbing, Missouri",2017,8.1,R,"Comedy, Crime, Drama",Martin McDonagh,"Frances McDormand, Caleb Landry Jones, Kerry Condon, Sam Rockwell",N/A,English,Won 2 Oscars. Another 130 wins & 225 nominations.,A mother personally challenges the local authorities to solve her daughter's murder when they fail to catch the culprit.
152,tt0015864,The Gold Rush,1925,8.1,Not Rated,"Adventure, Comedy, Drama, Family, Western",Charles Chaplin,"Charles Chaplin, Mack Swain, Tom Murray, Henry Bergman",N/A,English,Nominated for 2 Oscars. Another 3 wins & 1 nomination.,A prospector goes to the Klondike in search of gold and finds it and more.
153,tt0071315,Chinatown,1974,8.1,R,"Drama, Mystery, Thriller",Roman Polanski,"Jack Nicholson, Faye Dunaway, John Huston, Perry Lopez",Paramount Pictures,"English, Cantonese, Spanish",Won 1 Oscar. Another 20 wins & 24 nominations.,"A private detective hired to expose an adulterer finds himself caught up in a web of deceit, corruption, and murder."
154,tt0046912,Dial M for Murder,1954,8.1,PG,"Crime, Thriller",Alfred Hitchcock,"Ray Milland, Grace Kelly, Robert Cummings, John Williams",Warner Bros. Pictures,English,Nominated for 1 BAFTA Film Award. Another 5 wins & 2 nominations.,A tennis player frames his neglected wife for murder after she inadvertently foils his plan to have her murdered.
155,tt0434409,V for Vendetta,2005,8.1,R,"Action, Drama, Sci-Fi, Thriller",James McTeigue,"Natalie Portman, Hugo Weaving, Stephen Rea, Stephen Fry",Warner Bros. Pictures,English,7 wins & 27 nominations.,"In a future British tyranny, a shadowy freedom fighter, known only by the alias of ""V"", plots to overthrow it with the help of a young woman."
156,tt0050976,The Seventh Seal,1957,8.1,Not Rated,"Drama, Fantasy",Ingmar Bergman,"Gunnar Björnstrand, Bengt Ekerot, Nils Poppe, Max von Sydow",Janus Films,"Swedish, Latin",8 wins & 2 nominations.,"A man seeks answers about life, death, and the existence of God as he plays chess against the Grim Reaper during the Black Plague."
157,tt0477348,No Country for Old Men,2007,8.1,R,"Crime, Drama, Thriller","Ethan Coen, Joel Coen","Tommy Lee Jones, Javier Bardem, Josh Brolin, Woody Harrelson",Miramax Films,"English, Spanish",Won 4 Oscars. Another 159 wins & 138 nominations.,Violence and mayhem ensue after a hunter stumbles upon a drug deal gone wrong and more than two million dollars in cash near the Rio Grande.
158,tt2096673,Inside Out,2015,8.1,PG,"Animation, Adventure, Comedy, Drama, Family, Fantasy","Pete Docter, Ronnie Del Carmen(co-director)","Amy Poehler, Phyllis Smith, Richard Kind, Bill Hader",Disney/Pixar,English,Won 1 Oscar. Another 97 wins & 114 nominations.,"After young Riley is uprooted from her Midwest life and moved to San Francisco, her emotions - Joy, Fear, Anger, Disgust and Sadness - conflict on how best to navigate a new city, house, and school."
159,tt1291584,Warrior,2011,8.1,PG-13,"Drama, Sport",Gavin O'Connor,"Joel Edgerton, Tom Hardy, Nick Nolte, Jennifer Morrison",Lionsgate,"English, Spanish",Nominated for 1 Oscar. Another 5 wins & 21 nominations.,"The youngest son of an alcoholic former boxer returns home, where he's trained by his father for competition in a mixed martial arts tournament - a path that puts the fighter on a collision course with his estranged, older brother."
160,tt1130884,Shutter Island,2010,8.1,R,"Mystery, Thriller",Martin Scorsese,"Leonardo DiCaprio, Mark Ruffalo, Ben Kingsley, Max von Sydow",Paramount Studios,"English, German",11 wins & 65 nominations.,"In 1954, a U.S. Marshal investigates the disappearance of a murderer who escaped from a hospital for the criminally insane."
161,tt0117951,Trainspotting,1996,8.1,R,Drama,Danny Boyle,"Ewan McGregor, Ewen Bremner, Jonny Lee Miller, Kevin McKidd",Miramax Films,English,Nominated for 1 Oscar. Another 23 wins & 33 nominations.,"Renton, deeply immersed in the Edinburgh drug scene, tries to clean up and get out, despite the allure of the drugs and influence of friends."
162,tt0080678,The Elephant Man,1980,8.1,PG,"Biography, Drama",David Lynch,"Anthony Hopkins, John Hurt, Anne Bancroft, John Gielgud",Paramount,English,Nominated for 8 Oscars. Another 10 wins & 13 nominations.,"A Victorian surgeon rescues a heavily disfigured man who is mistreated while scraping a living as a side-show freak. Behind his monstrous façade, there is revealed a person of kindness, intelligence and sophistication."
163,tt0167404,The Sixth Sense,1999,8.1,PG-13,"Drama, Mystery, Thriller",M. Night Shyamalan,"Bruce Willis, Haley Joel Osment, Toni Collette, Olivia Williams",Hollywood/Buena Vista,"English, Latin, Spanish",Nominated for 6 Oscars. Another 36 wins & 49 nominations.,A boy who communicates with spirits seeks the help of a disheartened child psychologist.
164,tt0084787,The Thing,1982,8.1,R,"Horror, Mystery, Sci-Fi",John Carpenter,"Kurt Russell, Wilford Brimley, T.K. Carter, David Clennon",Universal Pictures,"English, Norwegian",3 nominations.,A research team in Antarctica is hunted by a shape-shifting alien that assumes the appearance of its victims.
165,tt0031381,Gone with the Wind,1939,8.1,Passed,"Drama, History, Romance, War","Victor Fleming, George Cukor, Sam Wood","Thomas Mitchell, Barbara O'Neil, Vivien Leigh, Evelyn Keyes",Loew&#39;s Inc.,English,Won 8 Oscars. Another 12 wins & 12 nominations.,A manipulative woman and a roguish man conduct a turbulent romance during the American Civil War and Reconstruction periods.
166,tt3170832,Room,2015,8.1,R,"Drama, Thriller",Lenny Abrahamson,"Brie Larson, Jacob Tremblay, Sean Bridgers, Wendy Crewson",Element Pictures,English,Won 1 Oscar. Another 104 wins & 140 nominations.,"Held captive for 7 years in an enclosed space, a woman and her young son finally gain their freedom, allowing the boy to experience the outside world for the first time."
167,tt0107290,Jurassic Park,1993,8.1,PG-13,"Action, Adventure, Sci-Fi, Thriller",Steven Spielberg,"Sam Neill, Laura Dern, Jeff Goldblum, Richard Attenborough",Universal Pictures,"English, Spanish",Won 3 Oscars. Another 39 wins & 27 nominations.,A pragmatic paleontologist visiting an almost complete theme park is tasked with protecting a couple of kids after a power failure causes the park's cloned dinosaurs to run loose.
168,tt0050986,Wild Strawberries,1957,8.1,Not Rated,"Drama, Romance",Ingmar Bergman,"Victor Sjöström, Bibi Andersson, Ingrid Thulin, Gunnar Björnstrand",Janus Films,"Swedish, Latin",Nominated for 1 Oscar. Another 16 wins & 3 nominations.,"After living a life marked by coldness, an aging professor is forced to confront the emptiness of his existence."
169,tt0083658,Blade Runner,1982,8.1,R,"Action, Sci-Fi, Thriller",Ridley Scott,"Harrison Ford, Rutger Hauer, Sean Young, Edward James Olmos",Warner Bros. Pictures,"English, German, Cantonese, Japanese, Hungarian, Arabic",Nominated for 2 Oscars. Another 12 wins & 16 nominations.,"A blade runner must pursue and terminate four replicants who stole a ship in space, and have returned to Earth to find their creator."
170,tt0050212,The Bridge on the River Kwai,1957,8.1,PG,"Adventure, Drama, War",David Lean,"William Holden, Alec Guinness, Jack Hawkins, Sessue Hayakawa",Columbia Pictures,"English, Japanese, Thai",Won 7 Oscars. Another 23 wins & 7 nominations.,"British POWs build a railway bridge across the river Kwai for their Japanese captors, oblivious of the Allies' plans to destroy it."
171,tt0266543,Finding Nemo,2003,8.1,G,"Animation, Adventure, Comedy, Family","Andrew Stanton, Lee Unkrich(co-director)","Albert Brooks, Ellen DeGeneres, Alexander Gould, Willem Dafoe",Walt Disney Pictures,English,Won 1 Oscar. Another 49 wins & 62 nominations.,"After his son is captured in the Great Barrier Reef and taken to Sydney, a timid clownfish sets out on a journey to bring him home."
172,tt0079944,Stalker,1979,8.1,Not Rated,"Drama, Sci-Fi",Andrei Tarkovsky,"Alisa Freyndlikh, Aleksandr Kaydanovskiy, Anatoliy Solonitsyn, Nikolay Grinko",Zweites Deutsches Fernsehen,Russian,2 wins & 2 nominations.,A guide leads two men through an area known as the Zone to find a room that grants wishes.
173,tt0047296,On the Waterfront,1954,8.1,Not Rated,"Crime, Drama, Thriller",Elia Kazan,"Marlon Brando, Karl Malden, Lee J. Cobb, Rod Steiger",Sony Pictures,English,Won 8 Oscars. Another 21 wins & 9 nominations.,An ex-prize fighter turned longshoreman struggles to stand up to his corrupt union bosses.
174,tt0041959,The Third Man,1949,8.1,Not Rated,"Film-Noir, Mystery, Thriller",Carol Reed,"Joseph Cotten, Alida Valli, Orson Welles, Trevor Howard",N/A,"English, German, Russian",Won 1 Oscar. Another 4 wins & 4 nominations.,"Pulp novelist Holly Martins travels to shadowy, postwar Vienna, only to find himself investigating the mysterious death of an old friend, Harry Lime."
175,tt0116282,Fargo,1996,8.1,R,"Crime, Drama, Thriller","Joel Coen, Ethan Coen","William H. Macy, Steve Buscemi, Peter Stormare, Kristin Rudrüd",Gramercy Pictures,English,Won 2 Oscars. Another 81 wins & 57 nominations.,Jerry Lundegaard's inept crime falls apart due to his and his henchmen's bungling and the persistent police work of the quite pregnant Marge Gunderson.
177,tt0120382,The Truman Show,1998,8.1,PG,"Comedy, Drama, Sci-Fi",Peter Weir,"Jim Carrey, Laura Linney, Noah Emmerich, Natascha McElhone",Paramount Pictures,English,Nominated for 3 Oscars. Another 40 wins & 65 nominations.,An insurance salesman discovers his whole life is actually a reality TV show.
178,tt1205489,Gran Torino,2008,8.1,R,Drama,Clint Eastwood,"Clint Eastwood, Christopher Carley, Bee Vang, Ahney Her",Warner Bros. Pictures/Village Roadshow,"English, Hmong",Nominated for 1 Golden Globe. Another 21 wins & 20 nominations.,"Disgruntled Korean War veteran Walt Kowalski sets out to reform his neighbor, Thao Lor, a Hmong teenager who tried to steal Kowalski's prized possession: a 1972 Gran Torino."
179,tt0046438,Tokyo Story,1953,8.1,Not Rated,Drama,Yasujirô Ozu,"Chishû Ryû, Chieko Higashiyama, Setsuko Hara, Haruko Sugimura",BFI Production,"Japanese, English",3 wins.,"An old couple visit their children and grandchildren in the city, but receive little attention."
180,tt0077416,The Deer Hunter,1978,8.1,R,"Drama, War",Michael Cimino,"Robert De Niro, John Cazale, John Savage, Christopher Walken",Universal Pictures,"English, Russian, Vietnamese, French",Won 5 Oscars. Another 19 wins & 26 nominations.,An in-depth examination of the ways in which the U.S. Vietnam War impacts and disrupts the lives of people in a small industrial town in Pennsylvania.
181,tt0353969,Memories of Murder,2003,8.1,Not Rated,"Action, Crime, Drama, Mystery, Thriller",Bong Joon Ho,"Kang-ho Song, Sang-kyung Kim, Roe-ha Kim, Jae-ho Song",Houston Lady Productions,"Korean, English",26 wins & 3 nominations.,"In a small Korean province in 1986, two detectives struggle with the case of multiple young women being found raped and murdered by an unknown culprit."
183,tt4729430,Klaus,2019,8.1,PG,"Animation, Adventure, Comedy, Family","Sergio Pablos, Carlos Martínez López(co-director)","Jason Schwartzman, J.K. Simmons, Rashida Jones, Will Sasso",N/A,"English, Saami",Nominated for 1 Oscar. Another 8 wins & 18 nominations.,"A simple act of kindness always sparks another, even in a frozen, faraway place. When Smeerensburg's new postman, Jesper, befriends toymaker Klaus, their gifts melt an age-old feud and deliver a sleigh full of holiday traditions."
184,tt0116231,The Bandit,1996,8.1,TV-MA,"Crime, Drama, Thriller",Yavuz Turgul,"Sener Sen, Ugur Yücel, Sermin Hürmeriç, Yesim Salkim",N/A,Turkish,2 wins.,"Baran the Bandit, released from prison after 35 years, searches for vengeance and his lover."
185,tt8108198,Andhadhun,2018,8.1,Not Rated,"Crime, Thriller",Sriram Raghavan,"Ayushmann Khurrana, Tabu, Radhika Apte, Anil Dhawan",N/A,"Hindi, English",25 wins & 25 nominations.,"A series of mysterious events change the life of a blind pianist, who must now report a crime that he should technically know nothing of."
186,tt0978762,Mary and Max,2009,8.1,Not Rated,"Animation, Comedy, Drama, Family",Adam Elliot,"Christopher Massey, Oliver Marks, Daisy Kocher, Daniel Marks",IFC Films,"English, Yiddish",4 wins & 9 nominations.,"A tale of friendship between two unlikely pen pals: Mary, a lonely, eight-year-old girl living in the suburbs of Melbourne, and Max, a forty-four-year old, severely obese man living in New York."
187,tt0118715,The Big Lebowski,1998,8.1,R,"Comedy, Crime, Sport","Joel Coen, Ethan Coen","Jeff Bridges, John Goodman, Julianne Moore, Steve Buscemi",Gramercy Pictures,"English, German, Hebrew, Spanish",5 wins & 17 nominations.,"Jeff ""The Dude"" Lebowski, mistaken for a millionaire of the same name, seeks restitution for his ruined rug and enlists his bowling buddies to help get it."
188,tt0107207,In the Name of the Father,1993,8.1,R,"Biography, Drama",Jim Sheridan,"Alison Crosbie, Daniel Day-Lewis, Philip King, Emma Thompson",Universal Pictures,English,Nominated for 7 Oscars. Another 7 wins & 34 nominations.,A man's coerced confession to an I.R.A. bombing he did not commit results in the imprisonment of his father as well. An English lawyer fights to free them.
189,tt2267998,Gone Girl,2014,8.1,R,"Drama, Mystery, Thriller",David Fincher,"Ben Affleck, Rosamund Pike, Neil Patrick Harris, Tyler Perry",20th Century Fox,English,Nominated for 1 Oscar. Another 64 wins & 183 nominations.,"With his wife's disappearance having become the focus of an intense media circus, a man sees the spotlight turned on him when it's suspected that he may not be innocent."
190,tt2119532,Hacksaw Ridge,2016,8.1,R,"Biography, Drama, History, War",Mel Gibson,"Andrew Garfield, Richard Pyros, Jacob Warner, Milo Gibson",N/A,"English, Japanese",Won 2 Oscars. Another 51 wins & 114 nominations.,"World War II American Army Medic Desmond T. Doss, who served during the Battle of Okinawa, refuses to kill people, and becomes the first man in American history to receive the Medal of Honor without firing a shot."
191,tt2278388,The Grand Budapest Hotel,2014,8.1,R,"Adventure, Comedy, Crime",Wes Anderson,"Ralph Fiennes, F. Murray Abraham, Mathieu Amalric, Adrien Brody",Fox Searchlight,"English, French, German",Won 4 Oscars. Another 130 wins & 225 nominations.,"A writer encounters the owner of an aging high-class hotel, who tells him of his early years serving as a lobby boy in the hotel's glorious years under an exceptional concierge."
192,tt0035446,To Be or Not to Be,1942,8.1,Passed,"Comedy, War",Ernst Lubitsch,"Carole Lombard, Jack Benny, Robert Stack, Felix Bressart",United Artists,"English, German",Nominated for 1 Oscar. Another 2 wins & 1 nomination.,"During the Nazi occupation of Poland, an acting troupe becomes embroiled in a Polish soldier's efforts to track down a German spy."
193,tt1950186,Ford v Ferrari,2019,8.1,PG-13,"Action, Biography, Drama, Sport",James Mangold,"Matt Damon, Christian Bale, Jon Bernthal, Caitriona Balfe",N/A,"English, Italian, French, Japanese",Won 2 Oscars. Another 21 wins & 73 nominations.,American car designer Carroll Shelby and driver Ken Miles battle corporate interference and the laws of physics to build a revolutionary race car for Ford in order to defeat Ferrari at the 24 Hours of Le Mans in 1966.
194,tt0060827,Persona,1966,8.1,Not Rated,"Drama, Thriller",Ingmar Bergman,"Bibi Andersson, Liv Ullmann, Margaretha Krook, Gunnar Björnstrand",Criterion Collection,"Swedish, English",Nominated for 1 BAFTA Film Award. Another 10 wins & 4 nominations.,A nurse is put in charge of a mute actress and finds that their personae are melding together.
195,tt0112471,Before Sunrise,1995,8.1,R,"Drama, Romance",Richard Linklater,"Ethan Hawke, Julie Delpy, Andrea Eckert, Hanno Pöschl",Sony Pictures,"English, German, French",1 win & 7 nominations.,"A young man and woman meet on a train in Europe, and wind up spending one evening together in Vienna. Unfortunately, both know that this will probably be their only night together."
196,tt0264464,Catch Me If You Can,2002,8.1,PG-13,"Biography, Crime, Drama",Steven Spielberg,"Leonardo DiCaprio, Tom Hanks, Christopher Walken, Martin Sheen",DreamWorks SKG,"English, French",Nominated for 2 Oscars. Another 16 wins & 44 nominations.,"A seasoned FBI agent pursues Frank Abagnale Jr. who, before his 19th birthday, successfully forged millions of dollars' worth of checks while posing as a Pan Am pilot, a doctor, and a legal prosecutor."
197,tt0892769,How to Train Your Dragon,2010,8.1,PG,"Animation, Action, Adventure, Family, Fantasy","Dean DeBlois, Chris Sanders","Jay Baruchel, Gerard Butler, Craig Ferguson, America Ferrera",Paramount/DWA,English,Nominated for 2 Oscars. Another 25 wins & 60 nominations.,"A hapless young Viking who aspires to hunt dragons becomes the unlikely friend of a young dragon himself, and learns there may be more to the creatures than he assumed."
198,tt0017925,The General,1926,8.1,Passed,"Action, Adventure, Comedy, Drama, War","Clyde Bruckman, Buster Keaton","Marion Mack, Glen Cavender, Jim Farley, Frederick Vroom",United Artists Films,English,2 wins & 1 nomination.,"When Union spies steal an engineer's beloved locomotive, he pursues it single-handedly and straight through enemy lines."
201,tt1392214,Prisoners,2013,8.1,R,"Crime, Drama, Mystery, Thriller",Denis Villeneuve,"Hugh Jackman, Jake Gyllenhaal, Viola Davis, Maria Bello",Warner Bros.,English,Nominated for 1 Oscar. Another 10 wins & 37 nominations.,"When Keller Dover's daughter and her friend go missing, he takes matters into his own hands as the police pursue multiple leads and the pressure mounts."
202,tt2024544,12 Years a Slave,2013,8.1,R,"Biography, Drama, History",Steve McQueen,"Chiwetel Ejiofor, Dwight Henry, Dickie Gravois, Bryan Batt",Fox Searchlight,English,Won 3 Oscars. Another 238 wins & 335 nominations.,"In the antebellum United States, Solomon Northup, a free black man from upstate New York, is abducted and sold into slavery."
203,tt0061512,Cool Hand Luke,1967,8.1,GP,"Crime, Drama",Stuart Rosenberg,"Paul Newman, George Kennedy, J.D. Cannon, Lou Antonio",Warner Bros.,English,Won 1 Oscar. Another 3 wins & 10 nominations.,"A laid back Southern man is sentenced to two years in a rural prison, but refuses to conform."
204,tt1392190,Mad Max: Fury Road,2015,8.1,R,"Action, Adventure, Sci-Fi, Thriller",George Miller,"Tom Hardy, Charlize Theron, Nicholas Hoult, Hugh Keays-Byrne",Warner Bros.,"English, Russian",Won 6 Oscars. Another 236 wins & 228 nominations.,"In a post-apocalyptic wasteland, a woman rebels against a tyrannical ruler in search for her homeland with the aid of a group of female prisoners, a psychotic worshiper, and a drifter named Max."
205,tt0072684,Barry Lyndon,1975,8.1,PG,"Adventure, Drama, History, War",Stanley Kubrick,"Ryan O'Neal, Marisa Berenson, Patrick Magee, Hardy Krüger",Warner Bros.,"English, German, French",Won 4 Oscars. Another 13 wins & 14 nominations.,An Irish rogue wins the heart of a rich widow and assumes her dead husband's aristocratic position in 18th-century England.
206,tt0074958,Network,1976,8.1,R,Drama,Sidney Lumet,"Faye Dunaway, William Holden, Peter Finch, Robert Duvall",MGM/United Artists,English,Won 4 Oscars. Another 16 wins & 26 nominations.,A television network cynically exploits a deranged former anchor's ravings and revelations about the news media for its own profit.
207,tt0046268,The Wages of Fear,1953,8.1,Not Rated,"Adventure, Drama, Thriller",Henri-Georges Clouzot,"Yves Montand, Charles Vanel, Folco Lulli, Peter van Eyck",Janus Films,"French, English, Spanish, German, Italian, Russian",Won 1 BAFTA Film Award. Another 5 wins.,"In a decrepit South American village, four men are hired to transport an urgent nitroglycerine shipment without the equipment that would make it safe."
208,tt0092005,Stand by Me,1986,8.1,R,"Adventure, Drama",Rob Reiner,"Wil Wheaton, River Phoenix, Corey Feldman, Jerry O'Connell",MCA Universal Home Video,English,Nominated for 1 Oscar. Another 5 wins & 10 nominations.,"After the death of one of his friends, a writer recounts a boyhood journey with his friends to find the body of a missing boy."
209,tt0758758,Into the Wild,2007,8.1,R,"Adventure, Biography, Drama",Sean Penn,"Emile Hirsch, Marcia Gay Harden, William Hurt, Jena Malone",Paramount Vantage,"English, Danish",Nominated for 2 Oscars. Another 23 wins & 104 nominations.,"After graduating from Emory University, top student and athlete Christopher McCandless abandons his possessions, gives his entire $24,000 savings account to charity and hitchhikes to Alaska to live in the wilderness. Along the way, Christopher encounters a series of characters that shape his life."
210,tt0405159,Million Dollar Baby,2004,8.1,PG-13,"Drama, Sport",Clint Eastwood,"Clint Eastwood, Hilary Swank, Morgan Freeman, Jay Baruchel",Warner Bros. Pictures,"English, Irish",Won 4 Oscars. Another 64 wins & 84 nominations.,A determined woman works with a hardened boxing trainer to become a professional.
211,tt0079470,Monty Python's Life of Brian,1979,8.1,R,Comedy,Terry Jones,"Graham Chapman, John Cleese, Terry Gilliam, Eric Idle",Warner Bros. Pictures,"English, Latin",N/A,"Born on the original Christmas in the stable next door to Jesus Christ, Brian of Nazareth (Graham Chapman) spends his life being mistaken for a messiah."
212,tt1028532,Hachi: A Dog's Tale,2009,8.1,G,"Drama, Family",Lasse Hallström,"Richard Gere, Joan Allen, Cary-Hiroyuki Tagawa, Sarah Roemer",Inferno Entertainment,"English, Japanese",1 nomination.,A college professor bonds with an abandoned dog he takes into his home.
213,tt0052618,Ben-Hur,1959,8.1,G,"Adventure, Drama, History",William Wyler,"Charlton Heston, Jack Hawkins, Haya Harareet, Stephen Boyd",MGM,English,Won 11 Oscars. Another 18 wins & 16 nominations.,"After a Jewish prince is betrayed and sent into slavery by a Roman friend, he regains his freedom and comes back for revenge."
214,tt0091763,Platoon,1986,8.1,R,"Drama, War",Oliver Stone,"Keith David, Forest Whitaker, Francesco Quinn, Kevin Dillon",Orion Pictures,"English, Vietnamese",Won 4 Oscars. Another 20 wins & 14 nominations.,A young soldier in Vietnam faces a moral crisis when confronted with the horrors of war and the duality of man.
