IMDb Rank,IMDb ID,Movie Title,Year Released,IMDb Rating,Rated,Genre,Director,Actors,Production,Language,Awards,Plot
1,tt0111161,The Shawshank Redemption,1994,9.2,R,Drama,Frank Darabont,"Tim Robbins, Morgan Freeman, Bob Gunton, William Sadler",Columbia Pictures,English,Nominated for 7 Oscars. Another 21 wins & 35 nominations.,"Two imprisoned men bond over a number of years, finding solace and eventual redemption through acts of common decency."
2,tt0068646,The Godfather,1972,9.1,R,"Crime, Drama",Francis Ford Coppola,"Marlon Brando, Al Pacino, James Caan, Richard S. Castellano",Paramount Pictures,"English, Italian, Latin",Won 3 Oscars. Another 26 wins & 30 nominations.,The aging patriarch of an organized crime dynasty transfers control of his clandestine empire to his reluctant son.
3,tt0071562,The Godfather: Part II,1974,9.0,R,"Crime, Drama",Francis Ford Coppola,"Al Pacino, Robert Duvall, Diane Keaton, Robert De Niro",Paramount Pictures,"English, Italian, Spanish, Latin, Sicilian",Won 6 Oscars. Another 11 wins & 20 nominations.,"The early life and career of Vito Corleone in 1920s New York City is portrayed, while his son, Michael, expands and tightens his grip on the family crime syndicate."
4,tt0468569,The Dark Knight,2008,9.0,PG-13,"Action, Crime, Drama, Thriller",Christopher Nolan,"Christian Bale, Heath Ledger, Aaron Eckhart, Michael Caine",Warner Bros. Pictures/Legendary,"English, Mandarin",Won 2 Oscars. Another 153 wins & 159 nominations.,"When the menace known as the Joker wreaks havoc and chaos on the people of Gotham, Batman must accept one of the greatest psychological and physical tests of his ability to fight injustice."
5,tt0050083,12 Angry Men,1957,8.9,Approved,Drama,Sidney Lumet,"Martin Balsam, John Fiedler, Lee J. Cobb, E.G. Marshall",Criterion Collection,English,Nominated for 3 Oscars. Another 16 wins & 9 nominations.,A jury holdout attempts to prevent a miscarriage of justice by forcing his colleagues to reconsider the evidence.
6,tt0108052,Schindler's List,1993,8.9,R,"Biography, Drama, History",Steven Spielberg,"Liam Neeson, Ben Kingsley, Ralph Fiennes, Caroline Goodall",Universal Pictures,"English, Hebrew, German, Polish",Won 7 Oscars. Another 83 wins & 49 nominations.,"In German-occupied Poland during World War II, industrialist Oskar Schindler gradually becomes concerned for his Jewish workforce after witnessing their persecution by the Nazis."
7,tt0167260,The Lord of the Rings: The Return of the King,2003,8.9,PG-13,"Adventure, Drama, Fantasy",Peter Jackson,"Noel Appleby, Ali Astin, Sean Astin, David Aston",New Line Cinema,"English, Quenya, Old English, Sindarin",Won 11 Oscars. Another 199 wins & 122 nominations.,Gandalf and Aragorn lead the World of Men against Sauron's army to draw his gaze from Frodo and Sam as they approach Mount Doom with the One Ring.
8,tt0110912,Pulp Fiction,1994,8.8,R,"Crime, Drama",Quentin Tarantino,"Tim Roth, Amanda Plummer, Laura Lovelace, John Travolta",Miramax Films,"English, Spanish, French",Won 1 Oscar. Another 68 wins & 74 nominations.,"The lives of two mob hitmen, a boxer, a gangster and his wife, and a pair of diner bandits intertwine in four tales of violence and redemption."
9,tt0060196,"The Good, the Bad and the Ugly",1966,8.8,R,Western,Sergio Leone,"Eli Wallach, Clint Eastwood, Lee Van Cleef, Aldo Giuffrè",United Artists,Italian,2 wins & 4 nominations.,A bounty hunting scam joins two men in an uneasy alliance against a third in a race to find a fortune in gold buried in a remote cemetery.
10,tt0120737,The Lord of the Rings: The Fellowship of the Ring,2001,8.8,PG-13,"Action, Adventure, Drama, Fantasy",Peter Jackson,"Alan Howard, Noel Appleby, Sean Astin, Sala Baker",New Line Cinema,"English, Sindarin",Won 4 Oscars. Another 115 wins & 124 nominations.,A meek Hobbit from the Shire and eight companions set out on a journey to destroy the powerful One Ring and save Middle-earth from the Dark Lord Sauron.
11,tt0137523,Fight Club,1999,8.8,R,Drama,David Fincher,"Edward Norton, Brad Pitt, Meat Loaf, Zach Grenier",20th Century Fox,English,Nominated for 1 Oscar. Another 10 wins & 37 nominations.,"An insomniac office worker and a devil-may-care soapmaker form an underground fight club that evolves into something much, much more."
12,tt0109830,Forrest Gump,1994,8.8,PG-13,"Drama, Romance",Robert Zemeckis,"Tom Hanks, Rebecca Williams, Sally Field, Michael Conner Humphreys",Paramount Pictures,English,Won 6 Oscars. Another 44 wins & 74 nominations.,"The presidencies of Kennedy and Johnson, the events of Vietnam, Watergate and other historical events unfold through the perspective of an Alabama man with an IQ of 75, whose only desire is to be reunited with his childhood sweetheart."
13,tt1375666,Inception,2010,8.7,PG-13,"Action, Adventure, Sci-Fi, Thriller",Christopher Nolan,"Leonardo DiCaprio, Joseph Gordon-Levitt, Ellen Page, Tom Hardy",Warner Bros. Pictures,"English, Japanese, French",Won 4 Oscars. Another 152 wins & 217 nominations.,A thief who steals corporate secrets through the use of dream-sharing technology is given the inverse task of planting an idea into the mind of a C.E.O.
14,tt0080684,Star Wars: Episode V - The Empire Strikes Back,1980,8.7,PG,"Action, Adventure, Fantasy, Sci-Fi",Irvin Kershner,"Mark Hamill, Harrison Ford, Carrie Fisher, Billy Dee Williams",Twentieth Century Fox,English,Won 1 Oscar. Another 24 wins & 20 nominations.,"After the Rebels are brutally overpowered by the Empire on the ice planet Hoth, Luke Skywalker begins Jedi training with Yoda, while his friends are pursued by Darth Vader and a bounty hunter named Boba Fett all over the galaxy."
15,tt0167261,The Lord of the Rings: The Two Towers,2002,8.7,PG-13,"Adventure, Drama, Fantasy",Peter Jackson,"Bruce Allpress, Sean Astin, John Bach, Sala Baker",New Line Cinema,"English, Sindarin, Old English",Won 2 Oscars. Another 123 wins & 137 nominations.,"While Frodo and Sam edge closer to Mordor with the help of the shifty Gollum, the divided fellowship makes a stand against Sauron's new ally, Saruman, and his hordes of Isengard."
16,tt0133093,The Matrix,1999,8.6,R,"Action, Sci-Fi","Lana Wachowski, Lilly Wachowski","Keanu Reeves, Laurence Fishburne, Carrie-Anne Moss, Hugo Weaving",Warner Bros. Pictures,English,Won 4 Oscars. Another 37 wins & 50 nominations.,A computer hacker learns from mysterious rebels about the true nature of his reality and his role in the war against its controllers.
17,tt0099685,Goodfellas,1990,8.6,R,"Biography, Crime, Drama",Martin Scorsese,"Robert De Niro, Ray Liotta, Joe Pesci, Lorraine Bracco",Warner Bros.,"English, Italian",Won 1 Oscar. Another 43 wins & 38 nominations.,"The story of Henry Hill and his life in the mob, covering his relationship with his wife Karen Hill and his mob partners Jimmy Conway and Tommy DeVito in the Italian-American crime syndicate."
18,tt0073486,One Flew Over the Cuckoo's Nest,1975,8.6,R,Drama,Milos Forman,"Jack Nicholson, Louise Fletcher, Will Sampson, Michael Berryman",United Artists,English,Won 5 Oscars. Another 30 wins & 13 nominations.,"A criminal pleads insanity and is admitted to a mental institution, where he rebels against the oppressive nurse and rallies up the scared patients."
19,tt0047478,Seven Samurai,1954,8.6,Not Rated,"Action, Adventure, Drama",Akira Kurosawa,"Toshirô Mifune, Takashi Shimura, Keiko Tsushima, Yukiko Shimazaki",Columbia Pictures,Japanese,Nominated for 2 Oscars. Another 5 wins & 6 nominations.,A poor village under attack by bandits recruits seven unemployed samurai to help them defend themselves.
20,tt0114369,Se7en,1995,8.6,R,"Crime, Drama, Mystery, Thriller",David Fincher,"Morgan Freeman, Andrew Kevin Walker, Daniel Zacapa, Brad Pitt",New Line Cinema,English,Nominated for 1 Oscar. Another 29 wins & 40 nominations.,"Two detectives, a rookie and a veteran, hunt a serial killer who uses the seven deadly sins as his motives."
21,tt0118799,Life Is Beautiful,1997,8.6,PG-13,"Comedy, Drama, Romance, War",Roberto Benigni,"Roberto Benigni, Nicoletta Braschi, Giorgio Cantarini, Giustino Durano",Miramax,"Italian, German, English",Won 3 Oscars. Another 67 wins & 51 nominations.,"When an open-minded Jewish librarian and his son become victims of the Holocaust, he uses a perfect mixture of will, humor, and imagination to protect his son from the dangers around their camp."
22,tt0317248,City of God,2002,8.6,R,"Crime, Drama","Fernando Meirelles, Kátia Lund(co-director)","Alexandre Rodrigues, Leandro Firmino, Phellipe Haagensen, Douglas Silva",Miramax Films,Portuguese,Nominated for 4 Oscars. Another 75 wins & 44 nominations.,"In the slums of Rio, two kids' paths diverge as one struggles to become a photographer and the other a kingpin."
23,tt0102926,The Silence of the Lambs,1991,8.6,R,"Crime, Drama, Thriller",Jonathan Demme,"Jodie Foster, Lawrence A. Bonney, Kasi Lemmons, Lawrence T. Wrentz",Orion Pictures Corporation,"English, Latin",Won 5 Oscars. Another 63 wins & 51 nominations.,"A young F.B.I. cadet must receive the help of an incarcerated and manipulative cannibal killer to help catch another serial killer, a madman who skins his victims."
24,tt0038650,It's a Wonderful Life,1946,8.6,Passed,"Drama, Family, Fantasy",Frank Capra,"James Stewart, Donna Reed, Lionel Barrymore, Thomas Mitchell",Liberty Films,"English, French",Nominated for 5 Oscars. Another 6 wins & 1 nomination.,An angel is sent from Heaven to help a desperately frustrated businessman by showing him what life would have been like if he had never existed.
25,tt0076759,Star Wars: Episode IV - A New Hope,1977,8.6,PG,"Action, Adventure, Fantasy, Sci-Fi",George Lucas,"Mark Hamill, Harrison Ford, Carrie Fisher, Peter Cushing",20th Century Fox,English,Won 6 Oscars. Another 52 wins & 28 nominations.,"Luke Skywalker joins forces with a Jedi Knight, a cocky pilot, a Wookiee and two droids to save the galaxy from the Empire's world-destroying battle station, while also attempting to rescue Princess Leia from the mysterious Darth Vader."
26,tt6751668,Parasite,2019,8.5,R,"Comedy, Drama, Thriller",Bong Joon Ho,"Kang-ho Song, Sun-kyun Lee, Yeo-jeong Jo, Woo-sik Choi",N/A,"Korean, English",Won 4 Oscars. Another 255 wins & 221 nominations.,"A poor family, the Kims, con their way into becoming the servants of a rich family, the Parks. But their easy life gets complicated when their deception is threatened with exposure."
27,tt0120815,Saving Private Ryan,1998,8.5,R,"Drama, War",Steven Spielberg,"Tom Hanks, Tom Sizemore, Edward Burns, Barry Pepper",Dreamworks Distribution,"English, French, German, Czech",Won 5 Oscars. Another 74 wins & 74 nominations.,"Following the Normandy Landings, a group of U.S. soldiers go behind enemy lines to retrieve a paratrooper whose brothers have been killed in action."
28,tt0245429,Spirited Away,2001,8.5,PG,"Animation, Adventure, Family, Fantasy, Mystery",Hayao Miyazaki,"Rumi Hiiragi, Miyu Irino, Mari Natsuki, Takashi Naitô",Walt Disney Pictures,Japanese,Won 1 Oscar. Another 57 wins & 30 nominations.,"During her family's move to the suburbs, a sullen 10-year-old girl wanders into a world ruled by gods, witches, and spirits, and where humans are changed into beasts."
29,tt0120689,The Green Mile,1999,8.5,R,"Crime, Drama, Fantasy, Mystery",Frank Darabont,"Tom Hanks, David Morse, Bonnie Hunt, Michael Clarke Duncan",Warner Bros. Pictures,"English, French",Nominated for 4 Oscars. Another 15 wins & 33 nominations.,"The lives of guards on Death Row are affected by one of their charges: a black man accused of child murder and rape, yet who has a mysterious gift."
30,tt0816692,Interstellar,2014,8.5,PG-13,"Adventure, Drama, Sci-Fi, Thriller",Christopher Nolan,"Ellen Burstyn, Matthew McConaughey, Mackenzie Foy, John Lithgow",Paramount Pictures,English,Won 1 Oscar. Another 43 wins & 147 nominations.,A team of explorers travel through a wormhole in space in an attempt to ensure humanity's survival.
31,tt0110413,Léon: The Professional,1994,8.5,R,"Action, Crime, Drama, Thriller",Luc Besson,"Jean Reno, Gary Oldman, Natalie Portman, Danny Aiello",Columbia Pictures,"English, Italian, French",6 wins & 14 nominations.,"Mathilda, a 12-year-old girl, is reluctantly taken in by Léon, a professional assassin, after her family is murdered. An unusual relationship forms as she becomes his protégée and learns the assassin's trade."
32,tt0114814,The Usual Suspects,1995,8.5,R,"Crime, Mystery, Thriller",Bryan Singer,"Stephen Baldwin, Gabriel Byrne, Benicio Del Toro, Kevin Pollak",Gramercy Pictures,"English, Hungarian, Spanish, French",Won 2 Oscars. Another 35 wins & 16 nominations.,"A sole survivor tells of the twisty events leading up to a horrific gun battle on a boat, which began when five criminals met at a seemingly random police lineup."
33,tt0056058,Harakiri,1962,8.5,Not Rated,"Action, Drama, History",Masaki Kobayashi,"Tatsuya Nakadai, Akira Ishihama, Shima Iwashita, Tetsurô Tanba",Criterion Collection,Japanese,8 wins & 2 nominations.,"When a ronin requesting seppuku at a feudal lord's palace is told of the brutal suicide of another ronin who previously visited, he reveals how their pasts are intertwined - and in doing so challenges the clan's integrity."
34,tt0110357,The Lion King,1994,8.5,G,"Animation, Adventure, Drama, Family, Musical","Roger Allers, Rob Minkoff","Rowan Atkinson, Matthew Broderick, Niketa Calame-Harris, Jim Cummings",Buena Vista,"English, Swahili, Xhosa, Zulu",Won 2 Oscars. Another 35 wins & 34 nominations.,"A Lion cub crown prince is tricked by a treacherous uncle into thinking he caused his father's death and flees into exile in despair, only to learn in adulthood his identity and his responsibilities."
35,tt0120586,American History X,1998,8.5,R,Drama,Tony Kaye,"Edward Norton, Edward Furlong, Beverly D'Angelo, Jennifer Lien",New Line Cinema,English,Nominated for 1 Oscar. Another 4 wins & 13 nominations.,A former neo-nazi skinhead tries to prevent his younger brother from going down the same wrong path that he did.
36,tt0253474,The Pianist,2002,8.5,R,"Biography, Drama, Music, War",Roman Polanski,"Adrien Brody, Emilia Fox, Michal Zebrowski, Ed Stoppard",Focus Features,"English, German, Russian",Won 3 Oscars. Another 54 wins & 73 nominations.,A Polish Jewish musician struggles to survive the destruction of the Warsaw ghetto of World War II.
37,tt0103064,Terminator 2: Judgment Day,1991,8.5,R,"Action, Sci-Fi",James Cameron,"Arnold Schwarzenegger, Linda Hamilton, Edward Furlong, Robert Patrick",TriStar Pictures,"English, Spanish",Won 4 Oscars. Another 32 wins & 33 nominations.,"A cyborg, identical to the one who failed to kill Sarah Connor, must now protect her teenage son, John Connor, from a more advanced and powerful cyborg."
38,tt0088763,Back to the Future,1985,8.5,PG,"Adventure, Comedy, Sci-Fi",Robert Zemeckis,"Michael J. Fox, Christopher Lloyd, Lea Thompson, Crispin Glover",Universal Pictures,English,Won 1 Oscar. Another 19 wins & 25 nominations.,"Marty McFly, a 17-year-old high school student, is accidentally sent thirty years into the past in a time-traveling DeLorean invented by his close friend, the eccentric scientist Doc Brown."
39,tt0027977,Modern Times,1936,8.5,G,"Comedy, Drama, Family, Romance",Charles Chaplin,"Charles Chaplin, Paulette Goddard, Henry Bergman, Tiny Sandford",United Artists,English,4 wins & 1 nomination.,The Tramp struggles to live in modern industrial society with the help of a young homeless woman.
40,tt0054215,Psycho,1960,8.5,R,"Horror, Mystery, Thriller",Alfred Hitchcock,"Anthony Perkins, Vera Miles, John Gavin, Janet Leigh",Paramount Pictures,English,Nominated for 4 Oscars. Another 5 wins & 10 nominations.,"A Phoenix secretary embezzles forty thousand dollars from her employer's client, goes on the run, and checks into a remote motel run by a young man under the domination of his mother."
41,tt0172495,Gladiator,2000,8.5,R,"Action, Adventure, Drama",Ridley Scott,"Russell Crowe, Joaquin Phoenix, Connie Nielsen, Oliver Reed",Dreamworks Distribution LLC,English,Won 5 Oscars. Another 54 wins & 104 nominations.,A former Roman General sets out to exact vengeance against the corrupt emperor who murdered his family and sent him into slavery.
42,tt0021749,City Lights,1931,8.5,G,"Comedy, Drama, Romance",Charles Chaplin,"Virginia Cherrill, Florence Lee, Harry Myers, Al Ernest Garcia",United Artists,English,3 wins.,"With the aid of a wealthy erratic tippler, a dewy-eyed tramp who has fallen in love with a sightless flower girl accumulates money to be able to help her medically."
43,tt0407887,The Departed,2006,8.5,R,"Crime, Drama, Thriller",Martin Scorsese,"Leonardo DiCaprio, Matt Damon, Jack Nicholson, Mark Wahlberg",Warner Bros. Pictures,"English, Cantonese",Won 4 Oscars. Another 94 wins & 139 nominations.,An undercover cop and a mole in the police attempt to identify each other while infiltrating an Irish gang in South Boston.
44,tt1675434,The Intouchables,2011,8.5,R,"Biography, Comedy, Drama","Olivier Nakache, Éric Toledano","François Cluzet, Omar Sy, Anne Le Ny, Audrey Fleurot",The Weinstein Company,"French, English",Nominated for 1 Golden Globe. Another 38 wins & 39 nominations.,"After he becomes a quadriplegic from a paragliding accident, an aristocrat hires a young man from the projects to be his caregiver."
45,tt2582802,Whiplash,2014,8.5,R,"Drama, Music",Damien Chazelle,"Miles Teller, J.K. Simmons, Paul Reiser, Melissa Benoist",Sony Pictures Classics,English,Won 3 Oscars. Another 91 wins & 143 nominations.,A promising young drummer enrolls at a cut-throat music conservatory where his dreams of greatness are mentored by an instructor who will stop at nothing to realize a student's potential.
46,tt0482571,The Prestige,2006,8.5,PG-13,"Drama, Mystery, Sci-Fi, Thriller",Christopher Nolan,"Hugh Jackman, Christian Bale, Michael Caine, Piper Perabo",Buena Vista Pictures,English,Nominated for 2 Oscars. Another 6 wins & 38 nominations.,"After a tragic accident, two stage magicians engage in a battle to create the ultimate illusion while sacrificing everything they have to outwit each other."
47,tt0064116,Once Upon a Time in the West,1968,8.5,PG-13,Western,Sergio Leone,"Claudia Cardinale, Henry Fonda, Jason Robards, Charles Bronson",Paramount Pictures,"Italian, English, Spanish",4 wins & 5 nominations.,A mysterious stranger with a harmonica joins forces with a notorious desperado to protect a beautiful widow from a ruthless assassin working for the railroad.
48,tt0095327,Grave of the Fireflies,1988,8.4,Not Rated,"Animation, Drama, War",Isao Takahata,"Tsutomu Tatsumi, Ayano Shiraishi, Yoshiko Shinohara, Akemi Yamaguchi",Shinchosha Company,Japanese,3 wins.,A young boy and his little sister struggle to survive in Japan during World War II.
49,tt0034583,Casablanca,1942,8.4,PG,"Drama, Romance, War",Michael Curtiz,"Humphrey Bogart, Ingrid Bergman, Paul Henreid, Claude Rains",Warner Bros. Pictures,"English, French, German, Italian",Won 3 Oscars. Another 5 wins & 9 nominations.,A cynical American expatriate struggles to decide whether or not he should help his former lover and her fugitive husband escape French Morocco.
50,tt0047396,Rear Window,1954,8.4,PG,"Mystery, Thriller",Alfred Hitchcock,"James Stewart, Grace Kelly, Wendell Corey, Thelma Ritter",Paramount Pictures,English,Nominated for 4 Oscars. Another 6 wins & 9 nominations.,A wheelchair-bound photographer spies on his neighbors from his apartment window and becomes convinced one of them has committed murder.
51,tt0095765,Cinema Paradiso,1988,8.4,R,Drama,Giuseppe Tornatore,"Antonella Attili, Enzo Cannavale, Isa Danieli, Leo Gullotta",Miramax Films,Italian,Won 1 Oscar. Another 24 wins & 31 nominations.,A filmmaker recalls his childhood when falling in love with the pictures at the cinema of his home village and forms a deep friendship with the cinema's projectionist.
52,tt7286456,Joker,2019,8.4,R,"Crime, Drama, Thriller",Todd Phillips,"Joaquin Phoenix, Robert De Niro, Zazie Beetz, Frances Conroy",N/A,English,Won 2 Oscars. Another 93 wins & 198 nominations.,"In Gotham City, mentally troubled comedian Arthur Fleck is disregarded and mistreated by society. He then embarks on a downward spiral of revolution and bloody crime. This path brings him face-to-face with his alter-ego: the Joker."
53,tt0078748,Alien,1979,8.4,R,"Horror, Sci-Fi",Ridley Scott,"Tom Skerritt, Sigourney Weaver, Veronica Cartwright, Harry Dean Stanton",20th Century Fox,English,Won 1 Oscar. Another 16 wins & 21 nominations.,"After a space merchant vessel receives an unknown transmission as a distress call, one of the crew is attacked by a mysterious life form and they soon realize that its life cycle has merely begun."
54,tt0078788,Apocalypse Now,1979,8.4,R,"Drama, Mystery, War",Francis Ford Coppola,"Marlon Brando, Martin Sheen, Robert Duvall, Frederic Forrest",United Artists,"English, French, Vietnamese",Won 2 Oscars. Another 18 wins & 32 nominations.,A U.S. Army officer serving in Vietnam is tasked with assassinating a renegade Special Forces Colonel who sees himself as a god.
55,tt0209144,Memento,2000,8.4,R,"Mystery, Thriller",Christopher Nolan,"Guy Pearce, Carrie-Anne Moss, Joe Pantoliano, Mark Boone Junior",Newmarket Films,English,Nominated for 2 Oscars. Another 57 wins & 56 nominations.,A man with short-term memory loss attempts to track down his wife's murderer.
56,tt0082971,Raiders of the Lost Ark,1981,8.4,PG,"Action, Adventure",Steven Spielberg,"Harrison Ford, Karen Allen, Paul Freeman, Ronald Lacey",Paramount Pictures,"English, German, Hebrew, Spanish, Arabic, Nepali",Won 4 Oscars. Another 31 wins & 24 nominations.,"In 1936, archaeologist and adventurer Indiana Jones is hired by the U.S. government to find the Ark of the Covenant before Adolf Hitler's Nazis can obtain its awesome powers."
57,tt0032553,The Great Dictator,1940,8.4,Passed,"Comedy, Drama, War",Charles Chaplin,"Charles Chaplin, Jack Oakie, Reginald Gardiner, Henry Daniell",Criterion Collection,"English, Esperanto",Nominated for 5 Oscars. Another 6 wins & 1 nomination.,Dictator Adenoid Hynkel tries to expand his empire while a poor Jewish barber tries to avoid persecution from Hynkel's regime.
58,tt0405094,The Lives of Others,2006,8.4,R,"Drama, Mystery, Thriller",Florian Henckel von Donnersmarck,"Martina Gedeck, Ulrich Mühe, Sebastian Koch, Ulrich Tukur",Sony Pictures Classics,German,Won 1 Oscar. Another 78 wins & 37 nominations.,"In 1984 East Berlin, an agent of the secret police, conducting surveillance on a writer and his lover, finds himself becoming increasingly absorbed by their lives."
59,tt1853728,Django Unchained,2012,8.4,R,"Drama, Western",Quentin Tarantino,"Jamie Foxx, Christoph Waltz, Leonardo DiCaprio, Kerry Washington",The Weinstein Co.,"English, German, French, Italian",Won 2 Oscars. Another 57 wins & 155 nominations.,"With the help of a German bounty hunter, a freed slave sets out to rescue his wife from a brutal Mississippi plantation owner."
60,tt0050825,Paths of Glory,1957,8.4,Approved,"Drama, War",Stanley Kubrick,"Kirk Douglas, Ralph Meeker, Adolphe Menjou, George Macready",United Artists,"English, German, Latin",Nominated for 1 BAFTA Film Award. Another 5 wins & 2 nominations.,"After refusing to attack an enemy position, a general accuses the soldiers of cowardice and their commanding officer must defend them."
61,tt0081505,The Shining,1980,8.4,R,"Drama, Horror",Stanley Kubrick,"Jack Nicholson, Shelley Duvall, Danny Lloyd, Scatman Crothers",Warner Bros. Pictures,English,4 wins & 7 nominations.,"A family heads to an isolated hotel for the winter where a sinister presence influences the father into violence, while his psychic son sees horrific forebodings from both past and future."
62,tt4154756,Avengers: Infinity War,2018,8.4,PG-13,"Action, Adventure, Sci-Fi","Anthony Russo, Joe Russo","Robert Downey Jr., Chris Hemsworth, Mark Ruffalo, Chris Evans",Walt Disney Pictures,English,Nominated for 1 Oscar. Another 44 wins & 71 nominations.,The Avengers and their allies must be willing to sacrifice all in an attempt to defeat the powerful Thanos before his blitz of devastation and ruin puts an end to the universe.
63,tt0910970,WALL·E,2008,8.4,G,"Animation, Adventure, Family, Sci-Fi",Andrew Stanton,"Ben Burtt, Elissa Knight, Jeff Garlin, Fred Willard",Walt Disney Pictures,English,Won 1 Oscar. Another 91 wins & 93 nominations.,"In the distant future, a small waste-collecting robot inadvertently embarks on a space journey that will ultimately decide the fate of mankind."
65,tt4633694,Spider-Man: Into the Spider-Verse,2018,8.4,PG,"Animation, Action, Adventure, Family, Sci-Fi","Bob Persichetti, Peter Ramsey, Rodney Rothman","Shameik Moore, Jake Johnson, Hailee Steinfeld, Mahershala Ali",Sony Pictures,"English, Spanish",Won 1 Oscar. Another 76 wins & 54 nominations.,"Teen Miles Morales becomes Spider-Man of his reality, crossing his path with five counterparts from other dimensions to stop a threat for all realities."
66,tt0119698,Princess Mononoke,1997,8.4,PG-13,"Animation, Adventure, Fantasy",Hayao Miyazaki,"Billy Crudup, Billy Bob Thornton, Minnie Driver, John DiMaggio",Miramax Films,Japanese,13 wins & 6 nominations.,"On a journey to find the cure for a Tatarigami's curse, Ashitaka finds himself in the middle of a war between the forest gods and Tatara, a mining colony. In this quest he also meets San, the Mononoke Hime."
68,tt0364569,Oldboy,2003,8.4,R,"Action, Drama, Mystery, Thriller",Chan-wook Park,"Min-sik Choi, Ji-Tae Yoo, Hye-jeong Kang, Dae-han Ji",Tartan Films,Korean,39 wins & 18 nominations.,"After being kidnapped and imprisoned for fifteen years, Oh Dae-Su is released, only to find that he must find his captor in five days."
69,tt0051201,Witness for the Prosecution,1957,8.4,Not Rated,"Crime, Drama, Mystery, Thriller",Billy Wilder,"Tyrone Power, Marlene Dietrich, Charles Laughton, Elsa Lanchester",MGM,"English, German",Nominated for 6 Oscars. Another 3 wins & 9 nominations.,A veteran British barrister must defend his client in a murder trial that has surprise after surprise.
